{
  "schema_version": "technical_task_router_row/v1",
  "row_id": "task-router-row-disallowed-model-001",
  "benchmark_spec_id": "technical-task-router-spec-v1",
  "eval_id": "technical-task-router-eval-001",
  "model_id": "technical-task-router-challenger",
  "task_descriptor": {
    "task_id": "optimize-sql-query",
    "task_type": "performance_tuning",
    "language": "sql",
    "estimated_complexity": "medium"
  },
  "allowed_models": ["fast-coder-v1", "db-specialist-v1"],
  "selected_models": ["db-specialist-v1", "unapproved-frontier-model"],
  "max_cost_usd": 0.6,
  "actual_cost_usd": 0.37,
  "completed_successfully": true,
  "scorer_ref": "technical_task_router.success_under_budget/v1",
  "observed_at": "2026-05-12T12:10:00Z"
}
