{
  "schema_version": "technical_task_router_row/v1",
  "row_id": "task-router-row-success-001",
  "benchmark_spec_id": "technical-task-router-spec-v1",
  "eval_id": "technical-task-router-eval-001",
  "model_id": "technical-task-router-challenger",
  "task_descriptor": {
    "task_id": "debug-flaky-pytest",
    "task_type": "code_debugging",
    "language": "python",
    "estimated_complexity": "medium"
  },
  "allowed_models": ["gpt-5.4", "claude-sonnet-4-6", "claude-haiku-4-5-20251001"],
  "selected_models": ["claude-sonnet-4-6", "claude-haiku-4-5-20251001"],
  "max_cost_usd": 0.5,
  "actual_cost_usd": 0.42,
  "completed_successfully": true,
  "scorer_ref": "technical_task_router.success_under_budget/v1",
  "observed_at": "2026-05-12T12:00:00Z",
  "metadata": {
    "workflow_id": "workflow-success-001"
  }
}
